0	1	0	0	species of Grey Wind	:Grey_Wind	:Direwolves
1	1	0	0	family of Grey Wind	:Grey_Wind	:Summer,:Ghost,:Shaggydog,:Lady,:Nymeria_(direwolf)
2	1	0	0	the season that Grey Wind appeared in	:Grey_Wind	:Season_1,:Season_3,:Season_2
0	1	0	0	White Harbor is city of	:White_Harbor	:The_North,:Kingdom_of_the_North
0	1	0	0	religion of White Harbor	:White_Harbor	:Faith_of_the_Seven,:Old_Gods_of_the_Forest
1	1	0	0	is at White Harbor	:White_Harbor	:Amarylis_Umber,:Othell_Yarwyck,:Wendel_Manderly,:Hobb,:Wyman_Manderly
2	1	0	0	location of White Harbor	:White_Harbor	:Westeros,:The_North
0	1	0	0	last of Pyat Pree	:Pyat_Pree	:Valar_Morghulis
0	1	0	0	killed by Pyat Pree	:Pyat_Pree	:Copper_King,:Silk_King,:Spice_King
1	1	0	0	what killed Pyat Pree	:Pyat_Pree	:Daenerys_Targaryen
2	1	0	0	episode Pyat Pree first appeared in	:Pyat_Pree	:Garden_of_Bones
0	1	0	0	culture of Otto Hightower	:Otto_Hightower	:Andals
0	1	0	0	preceded by Otto Hightower	:Otto_Hightower	:Hand_of_the_King,:Criston_Cole
1	1	0	0	allegiance of Otto Hightower	:Otto_Hightower	:Greens,:House_Hightower
2	1	0	0	preceded by Otto Hightower	:Otto_Hightower	:Criston_Cole
0	1	0	0	spouse of Aegon Targaryen	:Aegon_Targaryen_(son_of_Aenys)	:Rhaena_Targaryen_(daughter_of_Aenys)
0	1	0	0	allegiance of Aegon Targaryen	:Aegon_Targaryen_(son_of_Aenys)	:House_Targaryen
1	1	0	0	whose spouse is Aegon Targaryen	:Aegon_Targaryen_(son_of_Aenys)	:Rhaena_Targaryen_(daughter_of_Aenys)
2	1	0	0	whose child is Aegon Targaryen	:Aegon_Targaryen_(son_of_Aenys)	:Aenys_Targaryen
0	1	0	0	allegiance of Ornela	:Ornela	:Daenerys_Targaryen
0	1	0	0	where Ornela is	:Ornela	:Lhazar
1	1	0	0	religion of Ornela	:Ornela	:Great_Stallion
2	1	0	0	culture of Ornela	:Ornela	:Dothraki
2	1	0	0	a episode	:Type:Episode	:The_Winds_of_Winter,:Iron_From_Ice,:The_Ice_Dragon,:A_Nest_of_Vipers,:No_One,:The_Broken_Man,:The_House_of_Black_and_White,:Sons_of_Winter,:Book_of_the_Stranger,:The_Door,:Blood_of_My_Blood,:The_Wars_to_Come,:The_Lost_Lords,:Battle_of_the_Bastards_(episode),:The_Sword_in_the_Darkness
0	1	0	0	what Barristan Selmy is the side two commander of	:Barristan_Selmy	:Robert's_Rebellion,:Battle_of_the_Trident,:Siege_of_Old_Wyk
0	1	0	0	culture of Barristan Selmy	:Barristan_Selmy	:Andals
1	1	0	0	episode where Barristan Selmy was mentioned in	:Barristan_Selmy	:A_Man_Without_Honor
2	1	0	0	death episode of Barristan Selmy	:Barristan_Selmy	:Sons_of_the_Harpy_(episode)
0	1	0	0	sibling of Duncan Tuttle	:Duncan_Tuttle	:Gared's_father
0	1	0	0	last of Duncan Tuttle	:Duncan_Tuttle	:The_Ice_Dragon
1	1	0	0	death episode of Duncan Tuttle	:Duncan_Tuttle	:The_Ice_Dragon
2	1	0	0	first episode of Duncan Tuttle	:Duncan_Tuttle	:Iron_From_Ice
0	1	0	0	where Duncan is	:Duncan_the_Tall	:King's_Landing
0	1	0	0	title of Duncan the Tall	:Duncan_the_Tall	:Knighthood,:Lord_Commander_of_the_Kingsguard
1	1	0	0	family of Duncan	:Duncan_the_Tall	:Brienne_of_Tarth
2	1	0	0	Duncan the Tall first mentioned	:Duncan_the_Tall	:Lord_Snow,:Two_Swords
0	1	0	0	first episode of Mikken	:Mikken	:Winter_Is_Coming
0	1	0	0	the season that Mikken appeared in	:Mikken	:Season_1
1	1	0	0	allegiance of Mikken	:Mikken	:House_Stark
2	1	0	0	last of Mikken	:Mikken	:The_Kingsroad
0	1	0	0	whose family is Joyeuse Frey	:Joyeuse_Frey	:Neyela_Frey
0	1	0	0	what killed Joyeuse Frey	:Joyeuse_Frey	:Catelyn_Stark
1	1	0	0	the season that Joyeuse Frey appeared in	:Joyeuse_Frey	:Season_1,:Season_3
2	1	0	0	whose mother is Joyeuse Frey	:Joyeuse_Frey	:Roslin_Tully,:Lothar_Frey,:Walda_Frey_(The_Rains_of_Castamere),:Derwa_Frey,:Waldra_Frey,:Olyvar_Frey,:Arwaya_Frey
0	1	0	0	last of Hugh	:Hugh	:The_Wolf_and_the_Lion
0	1	0	0	what killed Hugh	:Hugh	:Gregor_Clegane
1	1	0	0	title of Hugh	:Hugh	:Knighthood
2	1	0	0	place of Hugh	:Hugh	:The_Vale_of_Arryn
0	1	0	0	last of Pycelle	:Pycelle	:The_Winds_of_Winter
0	1	0	0	what caused death of Pycelle	:Pycelle	:Qyburn
1	1	0	0	where Pycelle died for second side	:Pycelle	:Destruction_of_the_Great_Sept_of_Baelor
2	1	0	0	what Pycelle is the side two participant of	:Pycelle	:Destruction_of_the_Great_Sept_of_Baelor
0	1	0	0	a Settlement	:Type:Settlement	:King's_Landing,:Red_Keep,:Winterfell,:Meereen,:The_Twins,:Last_Hearth,:Braavos,:Storm's_End,:Harrenhal,:Dragonstone_(castle),:Astapor,:Riverrun,:Ironrath,:Karhold,:Volantis,:Craster's_Keep,:Highgarden,:The_Eyrie,:Oldtown,:Pyke_(castle),:Qarth,:Casterly_Rock,:Sunspear,:Deepwood_Motte,:Yunkai,:Castle_Black,:Lys,:Dragonstone_(island),:Moat_Cailin,:Starfall,:The_Dreadfort,:White_Harbor,:Great_Sept_of_Baelor,:Bear_Island,:Highpoint,:Horn_Hill,:Castle_Cerwyn,:Lord_of_Riverrun,:Qohor,:Runestone,:Pentos,:Evenfall_Hall,:Torrhen's_Square,:The_Hightower,:Greywater_Watch,:Hardhome,:Summerhall,:Seagard,:Stone_Hedge,:Lannisport,:Vaes_Dothrak,:Clegane's_Keep,:Castle_Stokeworth,:Water_Gardens,:Tyrosh,:Ashford,:Myr,:The_Citadel,:Blackhaven,:Tarth,:Rillwater_Crossing,:Brightwater_Keep,:Yi_Ti,:The_Crag,:Stonehelm,:Rain_House,:Haystack_Hall
0	1	0	0	founder of Kingdom of the Iron Islands	:Kingdom_of_the_Isles_and_Rivers	:Harwyn_Hoare
0	1	0	0	location of Kingdom of the Isles and Rivers	:Kingdom_of_the_Isles_and_Rivers	:Westeros
1	1	0	0	who rules Kingdom of the Iron Islands	:Kingdom_of_the_Isles_and_Rivers	:House_Hoare
2	1	0	0	live in Kingdom of the Iron Islands	:Kingdom_of_the_Isles_and_Rivers	:Ironborn
0	1	0	0	what Elaena Glenmore is the side one participant of	:Elaena_Glenmore	:Capture_of_the_Whitehill_Garrison
0	1	0	0	location of Elaena Glenmore	:Elaena_Glenmore	:Rillwater_Crossing
1	1	0	0	allegiance of Elaena Glenmore	:Elaena_Glenmore	:House_Forrester
2	1	0	0	father of Elaena Glenmore	:Elaena_Glenmore	:Glenmore_(Lord)
0	1	0	0	whose allegiance is House Hoare	:House_Hoare	:Harren_Hoare,:Harwyn_Hoare,:Qhorwyn_Hoare
0	1	0	0	whose first side is House Hoare	:House_Hoare	:Andal_Invasion
1	1	0	0	what was ruled by House Hoare	:House_Hoare	:Harrenhal,:Kingdom_of_the_Isles_and_Rivers
2	1	0	0	whose second side is House Hoare	:House_Hoare	:War_of_Conquest,:Unification_of_the_North,:Burning_of_Harrenhal
0	1	0	0	Valyrian Freehold is city of	:Valyrian_Freehold	:Bay_of_Dragons
0	1	0	0	has range Valyrian Freehold	:Valyrian_Freehold	:Dragons
1	1	0	0	founded by Valyrian Freehold	:Valyrian_Freehold	:Dragonstone_(castle),:Volantis,:Lys,:Qohor,:Pentos
2	1	0	0	is now Valyrian Freehold	:Valyrian_Freehold	:Bay_of_Dragons,:Free_Cities,:Valyrian_Peninsula
1	1	0	0	preceded by Warden	:Warden	:Roose_Bolton
2	1	0	0	whose title is Warden	:Warden	:Eddard_Stark,:Tywin_Lannister,:Ramsay_Bolton,:Mace_Tyrell,:Roose_Bolton,:Jon_Arryn,:Rickard_Stark,:Robin_Arryn,:Cregan_Stark,:Tytos_Lannister,:Luthor_Tyrell,:Torrhen_Stark,:Lyonel_Tyrell,:Harlen_Tyrell,:Jasper_Arryn,:Loren_Lannister,:Ronnel_Arryn_(King)
0	1	0	0	whose second side is Night's Watch	:Night's_Watch	:Fall_of_the_Night's_King,:Gorne_and_Gendel's_War
0	1	0	0	whose first side is Night's Watch	:Night's_Watch	:Conflict_Beyond_the_Wall,:Battle_of_Castle_Black,:Massacre_at_Hardhome,:Raid_on_Craster's_Keep,:Raid_by_the_Gods_Eye,:Mutiny_at_Craster's_Keep,:Battle_of_the_Fist_of_the_First_Men,:Sack_of_Mole's_Town
1	1	0	0	whose ruler is Night's Watch	:Night's_Watch	:Castle_Black,:The_Gift
2	1	0	0	killed by Night's Watch	:Night's_Watch	:Mag_Mar_Tun_Doh_Weg
0	1	0	0	is in Hardhome	:Hardhome	:Cotter
0	1	0	0	location of Hardhome	:Hardhome	:Westeros,:Beyond_the_Wall
1	1	0	0	religion of Hardhome	:Hardhome	:Old_Gods_of_the_Forest
2	1	0	0	Hardhome is a town in	:Hardhome	:Beyond_the_Wall
0	1	0	0	whose ruler is House Targaryen	:House_Targaryen	:King's_Landing,:Meereen,:Dragonstone_(castle),:Dragonstone_(island),:Summerhall
0	1	0	0	whose first side is House Targaryen	:House_Targaryen	:Liberation_of_Slaver's_Bay,:War_of_Conquest,:Second_Siege_of_Meereen,:Siege_of_Meereen,:Uprising_in_Meereen,:Massacre_of_the_Khalar_vezhven,:Battle_of_Yunkai,:War_of_the_Ninepenny_Kings,:Field_of_Fire,:Century_of_Blood,:Burning_of_Harrenhal,:Sack_of_Astapor,:Conquest_of_Dorne,:Battle_of_the_Redgrass_Field,:Last_Storm,:First_Dornish_War,:Faith_Militant_raid_on_the_Red_Keep,:Burning_of_the_Sept_of_Remembrance,:Vulture_Hunt,:Defiance_of_Duskendale
1	1	0	0	those allied with House Targaryen	:House_Targaryen	:Daenerys_Targaryen,:Tyrion_Lannister,:Aerys_II_Targaryen,:Rhaenyra_Targaryen,:Aegon_III_Targaryen,:Daeron_II_Targaryen,:Aegon_II_Targaryen,:Sandbox/Jon_Snow_(Updated),:Theon_Greyjoy,:Rhaegar_Targaryen,:Aegon_IV_Targaryen,:Maekar_Targaryen,:Aegon_I_Targaryen,:Daemon_I_Blackfyre,:Aegon_V_Targaryen,:Viserys_II_Targaryen,:Daemon_Targaryen,:Baelor_Targaryen,:Elia_Martell,:Jorah_Mormont,:Yara_Greyjoy,:Maegor_Targaryen,:Viserys_I_Targaryen,:Daario_Naharis,:Brynden_Rivers,:Viserys_Targaryen,:Varys,:Baelor_Targaryen_(son_of_Daeron_II),:Helaena_Targaryen,:Aerys_I_Targaryen,:Naerys_Targaryen,:Orys_Baratheon,:Aenys_Targaryen,:Lucerys_Velaryon,:Ellaria_Sand,:Alliser_Thorne,:Aemond_Targaryen,:Daeron_I_Targaryen,:Aemon,:Olenna_Tyrell,:Daenerys_Targaryen_(daughter_of_Aegon_IV),:Jaehaerys_I_Targaryen,:Rhaella_Targaryen,:Myriah_Martell,:Daena_Targaryen,:Aegor_Rivers,:Rossart,:Alicent_Hightower,:Rhaenys_Targaryen_(Queen_Who_Never_Was),:Grey_Worm,:Visenya_Targaryen,:Aelinor_Targaryen,:Rhaenys_Targaryen_(sister_of_Aegon_I),:Aerion_Targaryen,:Aemon_Targaryen_(Dragonknight),:Shiera_Seastar,:Jaehaera_Targaryen,:Pycelle,:Aegon_Targaryen_(son_of_Rhaegar),:Rhaenys_Targaryen_(daughter_of_Rhaegar),:Rhaegel_Targaryen,:Doreah,:Hizdahr_zo_Loraq,:Maelor_Targaryen,:Rhaena_Targaryen_(daughter_of_Aegon_III),:Duncan_Targaryen,:Jaehaerys_Targaryen_(son_of_Aegon_II),:Elaena_Targaryen,:Rhaego,:Cassana_Baratheon,:Dyanna_Dayne,:Daeron_Targaryen_(son_of_Aegon_V),:Duncan_the_Tall,:Irri,:Alysanne_Targaryen,:Raymont_Baratheon,:Rakharo,:Rhaena_Targaryen_(daughter_of_Aenys),:Mossador,:Lyonel_Tyrell,:Aegon_Targaryen_(son_of_Aenys),:Hugh_Hammer,:Ulf_the_White,:Lyman_Beesbury,:Qhono,:Malcolm_Branfield,:Missandei,:Jon_Connington,:Aemma_Arryn,:Kovarro,:Hallyne,:Aggo,:Kinvara,:White_Rat,:Branfield_(Lord),:Jaremy_Rykker
2	1	0	0	whose second side is House Targaryen	:House_Targaryen	:Robert's_Rebellion,:Battle_of_the_Trident,:Blackfyre_Rebellion,:Assault_on_Dragonstone
0	1	0	0	first episode is Hardhome	:Hardhome_(episode)	:Dim_Dalba
0	1	0	0	mentioned is episode Hardhome	:Hardhome_(episode)	:Joanna_Lannister
1	1	0	0	whose death episode is Hardhome	:Hardhome_(episode)	:Karsi,:Lord_of_Bones,:Loboda
2	1	0	0	whose last was Hardhome	:Hardhome_(episode)	:Lord_of_Bones
0	1	0	0	place of Shella Whent	:Shella_Whent	:Harrenhal
0	1	0	0	allegiance of Shella Whent	:Shella_Whent	:House_Tully
1	1	0	0	culture of Shella Whent	:Shella_Whent	:Andals
2	1	0	0	spouse of Shella Whent	:Shella_Whent	:Walter_Whent
0	1	0	0	title of Cley Cerwyn	:Cley_Cerwyn	:Castle_Cerwyn
0	1	0	0	allegiance of Cley Cerwyn	:Cley_Cerwyn	:House_Stark
1	1	0	0	whose child is Cley Cerwyn	:Cley_Cerwyn	:Medger_Cerwyn
2	1	0	0	religion of Cley Cerwyn	:Cley_Cerwyn	:Old_Gods_of_the_Forest
0	1	0	0	Summerhall is a castle in	:Summerhall	:The_Stormlands,:Kingdom_of_the_Stormlands,:Dornish_Marches
0	1	0	0	founder of Summerhall	:Summerhall	:Daeron_II_Targaryen
1	1	0	0	is in Summerhall	:Summerhall	:Aegon_V_Targaryen
2	1	0	0	who rules Summerhall	:Summerhall	:House_Targaryen
0	1	0	0	allegiance of Missandei	:Missandei	:House_Targaryen
0	1	0	0	lover of Missandei	:Missandei	:Grey_Worm
1	1	0	0	episode Missandei first appeared in	:Missandei	:Valar_Dohaeris
2	1	0	0	the season that Missandei appeared in	:Missandei	:Season_6,:Season_3,:Season_4,:Season_5,:Season_7
0	1	0	0	the season that Unnamed miller's wife appeared in	:Unnamed_miller's_wife	:Season_3,:Season_5
0	1	0	0	whose mother is Unnamed miller's wife	:Unnamed_miller's_wife	:Ramsay_Bolton
1	1	0	0	allegiance of Unnamed miller's wife	:Unnamed_miller's_wife	:House_Bolton
2	1	0	0	culture of Unnamed miller's wife	:Unnamed_miller's_wife	:Northmen
0	1	0	0	family of Morag Umber	:Morag_Umber	:Gareth_Umber,:Regan_Karstark,:Joseth_Umber,:Mycah_Umber,:Corin_Umber,:Lucan_Umber,:Harkon_Umber
0	1	0	0	whose mother is Morag Umber	:Morag_Umber	:Hothor_Umber
1	1	0	0	whose spouse is Morag Umber	:Morag_Umber	:Daragh_Umber
2	1	0	0	culture of Morag Umber	:Morag_Umber	:Northmen
0	1	0	0	last of Ilyn Payne	:Ilyn_Payne	:Blackwater
0	1	0	0	title of Ilyn Payne	:Ilyn_Payne	:Knighthood,:House_Lannister
1	1	0	0	allegiance of Ilyn Payne	:Ilyn_Payne	:House_Lannister,:House_Baratheon_of_King's_Landing
2	1	0	0	culture of Ilyn Payne	:Ilyn_Payne	:Andals
0	1	0	0	episode Varys first appeared in	:Varys	:Lord_Snow
0	1	0	0	what Varys is the side one commander of	:Varys	:Liberation_of_Slaver's_Bay
1	1	0	0	what Varys is the side one participant of	:Varys	:Court_trial_of_Tyrion_Lannister
2	1	0	0	succeeded Varys	:Varys	:Tommen_Baratheon,:Qyburn
0	1	0	0	the season that Drogon appeared in	:Drogon	:Season_1,:Season_6,:Season_3,:Season_4,:Season_2,:Season_5,:Season_7
0	1	0	0	place of Drogon	:Drogon	:Lhazar
1	1	0	0	whose first side force is Drogon	:Drogon	:Uprising_in_Meereen
2	1	0	0	allegiance of Drogon	:Drogon	:Daenerys_Targaryen
0	1	0	0	culture of Jack Bulwer	:Jack_Bulwer	:Andals
0	1	0	0	the season that Jack Bulwer appeared in	:Jack_Bulwer	:Season_4
1	1	0	0	whose first side force is Jack Bulwer	:Jack_Bulwer	:Sack_of_Mole's_Town
2	1	0	0	Jack Bulwer appeared in	:Jack_Bulwer	:The_Mountain_and_the_Viper
0	1	0	0	where Bolton officer is	:Bolton_officer	:The_North
0	1	0	0	episode where Bolton officer died	:Bolton_officer	:The_Red_Woman
1	1	0	0	allegiance of Bolton officer	:Bolton_officer	:House_Bolton
2	1	0	0	the season that Bolton officer appeared in	:Bolton_officer	:Season_6
0	1	0	0	what War of the Five Kings is concurrent with	:War_of_the_Five_Kings	:Liberation_of_Slaver's_Bay,:Conflict_Beyond_the_Wall,:Forrester-Whitehill_conflict
0	1	0	0	what second side of War of the Five Kings is	:War_of_the_Five_Kings	:House_Stark,:Free_Folk,:Battle_of_the_Bastards,:Red_Wedding,:House_Bolton,:House_Frey,:House_Greyjoy,:House_Forrester,:House_Tully,:House_Baratheon,:Kingdom_of_the_North,:The_Vale_of_Arryn,:House_Tyrell,:House_Umber,:The_Riverlands,:House_Arryn,:Second_Siege_of_Riverrun,:Assassination_of_Renly_I,:House_Karstark,:House_Baratheon_of_Dragonstone,:Kingdom_of_the_Iron_Islands,:House_Baelish
1	1	0	0	what is before War of the Five Kings	:War_of_the_Five_Kings	:Greyjoy_Rebellion,:Massacre_in_the_Red_Keep,:First_Trial_by_Combat_of_Tyrion_Lannister
2	1	0	0	battle of War of the Five Kings	:War_of_the_Five_Kings	:Destruction_of_the_Great_Sept_of_Baelor,:Battle_of_the_Bastards,:Red_Wedding,:Battle_of_the_Blackwater,:Battle_of_Castle_Black,:Battle_of_Ironrath,:Second_Siege_of_Riverrun,:Battle_of_Winterfell,:Assassination_at_Winterfell,:Battle_at_the_Mummer's_Ford,:Assassination_of_Renly_I,:Second_Trial_by_Combat_of_Tyrion_Lannister,:Purple_Wedding,:Sack_of_Winterfell,:Assassinations_at_the_Twins,:Battle_of_the_Whispering_Wood,:Raid_on_Craster's_Keep,:Surrender_of_Moat_Cailin,:Liberation_of_Harrenhal,:Battle_of_the_Green_Fork,:Fall_of_Winterfell,:Battle_of_Stone_Mill,:Capture_of_Riverrun,:Battle_of_Oxcross,:Battle_of_the_Camps,:Assassination_at_the_Tower_of_the_Hand,:Raid_by_the_Gods_Eye,:Siege_of_Riverrun,:Battle_of_the_Yellow_Fork,:Surrender_of_the_Crag,:Sack_of_Ashemark,:Assault_on_the_Dreadfort,:Raid_on_Torrhen's_Square,:Assassination_of_Balon_Greyjoy,:Second_Battle_of_Deepwood_Motte,:Fall_of_Moat_Cailin,:Liberation_of_Stone_Hedge,:First_Battle_of_Deepwood_Motte,:Liberation_of_Raventree_Hall,:Battle_of_the_Golden_Tooth
0	1	0	0	what first side of Sack of Mole's Town is	:Sack_of_Mole's_Town	:Night's_Watch
0	1	0	0	what second side of Sack of Mole's Town is	:Sack_of_Mole's_Town	:Free_Folk
1	1	0	0	side two commander of Sack of Mole's Town	:Sack_of_Mole's_Town	:Tormund,:Styr,:Thenns
2	1	0	0	what followed Sack of Mole's Town	:Sack_of_Mole's_Town	:Battle_of_Castle_Black
0	1	0	0	allegiance of Lyman Beesbury	:Lyman_Beesbury	:House_Targaryen,:Blacks
0	1	0	0	predecessor of Lyman Beesbury	:Lyman_Beesbury	:Daemon_Targaryen,:Master_of_Coin
1	1	0	0	whose predecessor is Lyman Beesbury	:Lyman_Beesbury	:Master_of_Coin,:Tyland_Lannister
2	1	0	0	culture of Lyman Beesbury	:Lyman_Beesbury	:Andals
0	1	0	0	culture of Shagga	:Shagga	:Hill_tribes
0	1	0	0	last of Shagga	:Shagga	:Baelor
1	1	0	0	first episode of Shagga	:Shagga	:The_Pointy_End
2	1	0	0	the season that Shagga appeared in	:Shagga	:Season_1
0	1	0	0	where Kraznys mo Nakloz is	:Kraznys_mo_Nakloz	:Astapor
0	1	0	0	what caused death of Kraznys mo Nakloz	:Kraznys_mo_Nakloz	:Drogon
1	1	0	0	the season that Kraznys mo Nakloz appeared in	:Kraznys_mo_Nakloz	:Season_3
2	1	0	0	last of Kraznys mo Nakloz	:Kraznys_mo_Nakloz	:And_Now_His_Watch_is_Ended
0	1	0	0	where First Dornish War happened	:First_Dornish_War	:Westeros,:Dorne
0	1	0	0	what second side of First Dornish War is	:First_Dornish_War	:House_Martell
1	1	0	0	what preceded First Dornish War	:First_Dornish_War	:Field_of_Fire
2	1	0	0	what first side of First Dornish War is	:First_Dornish_War	:House_Targaryen,:Iron_Throne,:House_Tyrell
0	1	0	0	allegiance of Jason Mallister	:Jason_Mallister	:House_Tully
0	1	0	0	whose family is Jason Mallister	:Jason_Mallister	:Jaremy_Mallister
1	1	0	0	what Jason Mallister is the side one commander of	:Jason_Mallister	:Robert's_Rebellion,:Greyjoy_Rebellion,:Battle_of_Stone_Mill
2	1	0	0	place of Jason Mallister	:Jason_Mallister	:Seagard
0	1	0	0	the season that Jafer Flowers appeared in	:Jafer_Flowers	:Season_1
0	1	0	0	Jafer Flowers appeared in	:Jafer_Flowers	:The_Pointy_End
1	1	0	0	culture of Jafer Flowers	:Jafer_Flowers	:Andals
2	1	0	0	location of Jafer Flowers	:Jafer_Flowers	:The_Reach
0	1	0	0	first episode of Dezhor zo Raza	:Dezhor_zo_Raza	:Sons_of_Winter
0	1	0	0	location of Dezhor zo Raza	:Dezhor_zo_Raza	:Meereen
1	1	0	0	what killed Dezhor zo Raza	:Dezhor_zo_Raza	:Asher_Forrester,:Beskha
2	1	0	0	culture of Dezhor zo Raza	:Dezhor_zo_Raza	:Meereen
0	1	0	0	what a conflict of Showdown at the Tower of Joy is	:Showdown_at_the_Tower_of_Joy	:Robert's_Rebellion
0	1	0	0	what preceded Showdown at the Tower of Joy	:Showdown_at_the_Tower_of_Joy	:Assault_on_Dragonstone
1	1	0	0	Showdown at the Tower of Joy is a battle of	:Showdown_at_the_Tower_of_Joy	:Robert's_Rebellion
2	1	0	0	side one commander of Showdown at the Tower of Joy	:Showdown_at_the_Tower_of_Joy	:Eddard_Stark,:Howland_Reed
0	1	0	0	whose child is Brienne of Tarth	:Brienne_of_Tarth	:Selwyn_Tarth
0	1	0	0	whose allegiance is Brienne of Tarth	:Brienne_of_Tarth	:Podrick_Payne
1	1	0	0	place of Brienne of Tarth	:Brienne_of_Tarth	:Evenfall_Hall
2	1	0	0	allegiance of Brienne of Tarth	:Brienne_of_Tarth	:House_Stark,:Kingsguard,:Renly_Baratheon
0	1	0	0	died in Massacre at Hardhome for first side	:Massacre_at_Hardhome	:Karsi,:Loboda
0	1	0	0	what a conflict of Massacre at Hardhome is	:Massacre_at_Hardhome	:Conflict_Beyond_the_Wall
1	1	0	0	what is before Massacre at Hardhome	:Massacre_at_Hardhome	:Battle_of_Castle_Black
2	1	0	0	what second side of Massacre at Hardhome is	:Massacre_at_Hardhome	:White_Walkers
0	1	0	0	allegiance of Sybelle Glover	:Sybelle_Glover	:House_Glover
0	1	0	0	whose spouse is Sybelle Glover	:Sybelle_Glover	:Robett_Glover
1	1	0	0	culture of Sybelle Glover	:Sybelle_Glover	:Northmen
2	1	0	0	the season that Sybelle Glover appeared in	:Sybelle_Glover	:Season_6
0	1	0	0	family of Damon Marbrand	:Damon_Marbrand	:Addam_Marbrand
0	1	0	0	allegiance of Damon Marbrand	:Damon_Marbrand	:House_Lannister
1	1	0	0	culture of Damon Marbrand	:Damon_Marbrand	:Andals
2	1	0	0	episode where Damon Marbrand was mentioned in	:Damon_Marbrand	:The_Old_Gods_and_the_New
0	1	0	0	where Durran is	:Durran	:The_Stormlands
0	1	0	0	the season that Durran appeared in	:Durran	:Histories_&_Lore
1	1	0	0	founded by Durran	:Durran	:The_Stormlands,:Storm's_End,:Kingdom_of_the_Stormlands
2	1	0	0	allegiance of Durran	:Durran	:House_Durrandon
0	1	0	0	the season that Wyman Manderly appeared in	:Wyman_Manderly	:Season_6
0	1	0	0	allegiance of Wyman Manderly	:Wyman_Manderly	:House_Stark
1	1	0	0	place of Wyman Manderly	:Wyman_Manderly	:White_Harbor
2	1	0	0	child of Wyman Manderly	:Wyman_Manderly	:Wendel_Manderly
0	1	0	0	death episode of White Rat	:White_Rat	:The_Wars_to_Come
0	1	0	0	allegiance of White Rat	:White_Rat	:House_Targaryen,:Unsullied
1	1	0	0	White Rat appeared in	:White_Rat	:The_Wars_to_Come
2	1	0	0	what caused death of White Rat	:White_Rat	:Sons_of_the_Harpy
0	1	0	0	last of Tommen I Baratheon	:Tommen_Baratheon	:The_Winds_of_Winter
0	1	0	0	what Tommen I Baratheon is the side one commander of	:Tommen_Baratheon	:War_of_the_Five_Kings
1	1	0	0	whose child is Tommen Baratheon	:Tommen_Baratheon	:Robert_Baratheon,:Cersei_Lannister,:Jaime_Lannister
2	1	0	0	the season that Tommen I Baratheon appeared in	:Tommen_Baratheon	:Season_1,:Season_6,:Season_4,:Season_2,:Season_5
0	1	0	0	episode where Mossador died	:Mossador	:The_House_of_Black_and_White
0	1	0	0	last of Mossador	:Mossador	:The_House_of_Black_and_White
1	1	0	0	died from Mossador	:Mossador	:Son_of_the_Harpy
2	1	0	0	first episode of Mossador	:Mossador	:Oathkeeper
0	1	0	0	family of Craster's wife	:Craster's_wife_(Walk_of_Punishment)	:Craster
0	1	0	0	allegiance of Craster's wife	:Craster's_wife_(Walk_of_Punishment)	:Craster
1	1	0	0	Craster's wife appeared in	:Craster's_wife_(Walk_of_Punishment)	:Walk_of_Punishment
2	1	0	0	religion of Craster's wife	:Craster's_wife_(Walk_of_Punishment)	:White_Walkers
0	1	0	0	what killed Simpson	:Simpson	:Stannis_Baratheon
0	1	0	0	where Simpson died for first side	:Simpson	:Battle_of_Winterfell
1	1	0	0	Simpson appeared in	:Simpson	:Mother's_Mercy
2	1	0	0	culture of Simpson	:Simpson	:Northmen
0	1	0	0	death episode of Asher Forrester	:Asher_Forrester	:A_Nest_of_Vipers
0	1	0	0	allegiance of Asher Forrester	:Asher_Forrester	:House_Forrester
1	1	0	0	father of Asher Forrester	:Asher_Forrester	:Gregor_Forrester
2	1	0	0	culture of Asher Forrester	:Asher_Forrester	:Northmen
0	1	0	0	what first side of Conquest of Dorne is	:Conquest_of_Dorne	:House_Targaryen,:Iron_Throne,:House_Tyrell
0	1	0	0	what followed Conquest of Dorne	:Conquest_of_Dorne	:Blackfyre_Rebellion
1	1	0	0	killed by Conquest of Dorne	:Conquest_of_Dorne	:Daeron_I_Targaryen
2	1	0	0	where Conquest of Dorne took place	:Conquest_of_Dorne	:Westeros,:Dorne
0	1	0	0	what killed Maelys Blackfyre	:Maelys_Blackfyre	:Barristan_Selmy,:Stepstones
0	1	0	0	what Maelys Blackfyre is the side two commander of	:Maelys_Blackfyre	:War_of_the_Ninepenny_Kings
1	1	0	0	allegiance of Maelys Blackfyre	:Maelys_Blackfyre	:House_Blackfyre
2	1	0	0	title of Maelys Blackfyre	:Maelys_Blackfyre	:King_of_the_Andals,_the_Rhoynar,_and_the_First_Men,:Protector_of_the_Realm,:Lord_of_the_Seven_Kingdoms
0	1	0	0	culture of Raymont Baratheon	:Raymont_Baratheon	:Valyrians
0	1	0	0	the season that Raymont Baratheon appeared in	:Raymont_Baratheon	:Season_1
1	1	0	0	whose child is Raymont Baratheon	:Raymont_Baratheon	:Orys_Baratheon,:Argalia_Baratheon
2	1	0	0	whose sibling is Raymont Baratheon	:Raymont_Baratheon	:Mychal_Baratheon,:Ethelide_Baratheon
0	1	0	0	allegiance of Davos Dayne	:Davos_Dayne	:House_Martell,:House_Dayne
0	1	0	0	child of Davos Dayne	:Davos_Dayne	:Dayne_(son_of_Davos)
1	1	0	0	title of Davos Dayne	:Davos_Dayne	:Knighthood
2	1	0	0	whose father is Davos Dayne	:Davos_Dayne	:Dayne_(son_of_Davos),:Martell_(daughter_of_Mors)
0	1	0	0	Forzho appeared in	:Forzho	:Book_of_the_Stranger
0	1	0	0	what caused death of Forzho	:Forzho	:Daenerys_Targaryen
1	1	0	0	where Forzho is	:Forzho	:Dothraki_Sea
2	1	0	0	the season that Forzho appeared in	:Forzho	:Season_6
0	1	0	0	a place in The Stormlands	:The_Stormlands	:Dornish_Marches,:Tarth
0	1	0	0	located in The Stormlands	:The_Stormlands	:Beric_Dondarrion,:Anguy,:Durran
1	1	0	0	whose second side is The Stormlands	:The_Stormlands	:Battle_of_the_Blackwater
2	1	0	0	location of The Stormlands	:The_Stormlands	:Westeros
0	1	0	0	allegiance of Balon Swann	:Balon_Swann	:Kingsguard
0	1	0	0	place of Balon Swann	:Balon_Swann	:Stonehelm
1	1	0	0	the season that Balon Swann appeared in	:Balon_Swann	:Season_3,:Season_2,:Season_5
2	1	0	0	culture of Balon Swann	:Balon_Swann	:Andals
0	1	0	0	located in Brightwater Keep	:Brightwater_Keep	:Melessa_Tarly,:Axell_Florent,:Imry_Florent
0	1	0	0	has the Brightwater Keep castle	:Brightwater_Keep	:The_Reach,:Kingdom_of_the_Reach
1	1	0	0	location of Brightwater Keep	:Brightwater_Keep	:Westeros
2	1	0	0	religion of Brightwater Keep	:Brightwater_Keep	:Faith_of_the_Seven
0	1	0	0	who ruled The Reach	:The_Reach	:House_Tyrell
0	1	0	0	founder of The Reach	:The_Reach	:Garth_Gardener
1	1	0	0	located in The Reach	:The_Reach	:Highgarden,:Oldtown,:Horn_Hill,:The_Arbor,:Ashford,:The_Citadel
2	1	0	0	city of The Reach	:The_Reach	:Oldtown
0	1	0	0	location of Purple Wedding	:Purple_Wedding	:King's_Landing,:Westeros
0	1	0	0	what Purple Wedding is the side one commander of	:Purple_Wedding	:War_of_the_Five_Kings
1	1	0	0	what is after Purple Wedding	:Purple_Wedding	:Battle_of_Ironrath
2	1	0	0	what second side of Purple Wedding is	:Purple_Wedding	:House_Tyrell,:Olenna_Tyrell,:House_Baelish
0	1	0	0	culture of Rhaella Targaryen	:Rhaella_Targaryen	:Valyrians
0	1	0	0	whose sibling is Rhaella Targaryen	:Rhaella_Targaryen	:Aerys_II_Targaryen,:Duncan_Targaryen,:Daeron_Targaryen_(son_of_Aegon_V)
1	1	0	0	father of Rhaella Targaryen	:Rhaella_Targaryen	:Aegon_V_Targaryen
2	1	0	0	child of Rhaella Targaryen	:Rhaella_Targaryen	:Daenerys_Targaryen,:Rhaegar_Targaryen,:Viserys_Targaryen
0	1	0	0	location of Commard Karstark	:Commard_Karstark	:Karhold
0	1	0	0	whose spouse is Commard Karstark	:Commard_Karstark	:Regan_Karstark
1	1	0	0	father of Commard Karstark	:Commard_Karstark	:Beric_Karstark
2	1	0	0	allegiance of Commard Karstark	:Commard_Karstark	:House_Karstark
0	1	0	0	what House Velaryon is the side one commander of	:House_Velaryon	:War_of_Conquest
0	1	0	0	whose first side is House Velaryon	:House_Velaryon	:War_of_Conquest,:Dance_of_the_Dragons
1	1	0	0	whose second side is House Velaryon	:House_Velaryon	:Battle_of_the_Gullet
2	1	0	0	those allied with House Velaryon	:House_Velaryon	:Lucerys_Velaryon,:Joffrey_Velaryon,:Rhaenys_Targaryen_(Queen_Who_Never_Was),:Jacaerys_Velaryon,:Laenor_Velaryon,:Corlys_Velaryon
