2	1	0	0	whose allegiance is House Umber	:House_Umber	:Gareth_Umber,:Regan_Karstark,:Joseth_Umber,:Mycah_Umber,:Hothor_Umber,:Corin_Umber,:Lucan_Umber,:Harkon_Umber,:Amarylis_Umber,:Morag_Umber,:Jon_Umber_(Greatjon),:Hollys_Umber,:Morgana_Umber,:Finn_Umber,:Kear_Umber,:Brandon_Umber,:Emilia_Umber,:Daragh_Umber,:Jon_Umber_(Smalljon),:Katrina_Umber,:Maynard_Umber,:Cedric_Umber
0	1	0	0	located in Greywater Watch	:Greywater_Watch	:Howland_Reed,:Jojen_Reed
0	1	0	0	location of Greywater Watch	:Greywater_Watch	:Westeros,:The_North,:The_Neck
1	1	0	0	has the Greywater Watch castle	:Greywater_Watch	:The_North,:Kingdom_of_the_North,:The_Neck
2	1	0	0	religion of Greywater Watch	:Greywater_Watch	:Old_Gods_of_the_Forest
0	1	0	0	spouse of Rhaenys Targaryen	:Rhaenys_Targaryen_(Queen_Who_Never_Was)	:Corlys_Velaryon
0	1	0	0	culture of Rhaenys Targaryen	:Rhaenys_Targaryen_(Queen_Who_Never_Was)	:Valyrians
1	1	0	0	whose second side casualty is Rhaenys Targaryen	:Rhaenys_Targaryen_(Queen_Who_Never_Was)	:Siege_of_Rook's_Rest
2	1	0	0	whose spouse is Rhaenys Targaryen	:Rhaenys_Targaryen_(Queen_Who_Never_Was)	:Corlys_Velaryon
0	1	0	0	allegiance of Pypar	:Pypar	:Night's_Watch
0	1	0	0	the season that Pypar appeared in	:Pypar	:Season_1,:Season_3,:Season_4
1	1	0	0	last of Pypar	:Pypar	:The_Children,:The_Watchers_on_the_Wall
2	1	0	0	episode where Pypar was mentioned in	:Pypar	:Kill_the_Boy
0	1	0	0	father of Aegon IV Targaryen	:Aegon_IV_Targaryen	:Viserys_II_Targaryen
0	1	0	0	spouse of Aegon IV Targaryen	:Aegon_IV_Targaryen	:Naerys_Targaryen
1	1	0	0	whose family is Aegon IV Targaryen	:Aegon_IV_Targaryen	:Naerys_Targaryen
2	1	0	0	sibling of Aegon IV Targaryen	:Aegon_IV_Targaryen	:Naerys_Targaryen,:Aemon_Targaryen_(Dragonknight)
0	1	0	0	those allied with House Clegane	:House_Clegane	:Gregor_Clegane,:Sandor_Clegane,:The_Tickler
0	1	0	0	whose first side is House Clegane	:House_Clegane	:Battle_at_the_Mummer's_Ford
1	1	0	0	whose ruler is House Clegane	:House_Clegane	:Clegane's_Keep
2	1	0	0	whose second side is House Clegane	:House_Clegane	:Massacre_in_the_Red_Keep,:Liberation_of_Harrenhal,:Battle_of_Stone_Mill
0	1	0	0	whose death episode is The Door	:The_Door	:Summer,:Hodor,:Leaf,:Three-eyed_raven
0	1	0	0	what preceded The Door	:The_Door	:Book_of_the_Stranger
1	1	0	0	what was preceded by The Door	:The_Door	:Blood_of_My_Blood
2	1	0	0	The Door is the last of	:The_Door	:Summer,:Hodor,:Rodrik_Cassel,:Leaf,:Three-eyed_raven,:Old_Nan
0	1	0	0	the season that Aeron Greyjoy appeared in	:Aeron_Greyjoy	:Season_6,:Season_7
0	1	0	0	whose sibling is Aeron Greyjoy	:Aeron_Greyjoy	:Balon_Greyjoy,:Euron_Greyjoy
1	1	0	0	culture of Aeron Greyjoy	:Aeron_Greyjoy	:Ironborn
2	1	0	0	place of Aeron Greyjoy	:Aeron_Greyjoy	:Pyke_(castle)
0	1	0	0	mother of Lollys Stokeworth	:Lollys_Stokeworth	:Tanda_Stokeworth
0	1	0	0	Lollys Stokeworth appeared in	:Lollys_Stokeworth	:The_House_of_Black_and_White
1	1	0	0	whose child is Lollys Stokeworth	:Lollys_Stokeworth	:Tanda_Stokeworth,:Stokeworth_(Lord)
2	1	0	0	the season that Lollys Stokeworth appeared in	:Lollys_Stokeworth	:Season_5
0	1	0	0	death episode of Wallen	:Wallen	:A_Golden_Crown
0	1	0	0	Wallen appeared in	:Wallen	:A_Golden_Crown
1	1	0	0	what killed Wallen	:Wallen	:Robb_Stark
2	1	0	0	the season that Wallen appeared in	:Wallen	:Season_1
0	1	0	0	founded by Maegor Targaryen	:Maegor_Targaryen	:Red_Keep
0	1	0	0	father of Maegor Targaryen	:Maegor_Targaryen	:Aegon_I_Targaryen
1	1	0	0	preceded Maegor Targaryen	:Maegor_Targaryen	:Aenys_Targaryen
2	1	0	0	allegiance of Maegor I Targaryen	:Maegor_Targaryen	:House_Targaryen
0	1	0	0	religion of Highpoint	:Highpoint	:Faith_of_the_Seven
0	1	0	0	location of Highpoint	:Highpoint	:Westeros,:The_North
1	1	0	0	has the Highpoint castle	:Highpoint	:The_North,:Kingdom_of_the_North
2	1	0	0	who rules Highpoint	:Highpoint	:House_Whitehill
0	1	0	0	whose child is Maron Greyjoy	:Maron_Greyjoy	:Balon_Greyjoy,:Alannys_Greyjoy
0	1	0	0	whose sibling is Maron Greyjoy	:Maron_Greyjoy	:Theon_Greyjoy,:Yara_Greyjoy,:Rodrik_Greyjoy
1	1	0	0	culture of Maron Greyjoy	:Maron_Greyjoy	:Ironborn
2	1	0	0	episode where Maron Greyjoy was mentioned in	:Maron_Greyjoy	:The_Night_Lands
0	1	0	0	location of Vulture Hunt	:Vulture_Hunt	:Westeros,:Dornish_Marches
0	1	0	0	what followed Vulture Hunt	:Vulture_Hunt	:Faith_Militant_uprising
1	1	0	0	commanded one side in Vulture Hunt	:Vulture_Hunt	:Orys_Baratheon,:Aenys_Targaryen
2	1	0	0	what was preceded by Vulture Hunt	:Vulture_Hunt	:Faith_Militant_uprising
0	1	0	0	religion of Smalljon Umber	:Jon_Umber_(Smalljon)	:Old_Gods_of_the_Forest
0	1	0	0	what caused death of Jon Umber	:Jon_Umber_(Smalljon)	:Tormund
1	1	0	0	first episode of Smalljon Umber	:Jon_Umber_(Smalljon)	:Oathbreaker
2	1	0	0	culture of Jon Umber	:Jon_Umber_(Smalljon)	:Northmen
0	1	0	0	last of Jeor Mormont	:Jeor_Mormont	:And_Now_His_Watch_is_Ended
0	1	0	0	whose sibling is Jeor Mormont	:Jeor_Mormont	:Maege_Mormont
1	1	0	0	what Jeor Mormont is the side one commander of	:Jeor_Mormont	:Conflict_Beyond_the_Wall,:Mutiny_at_Craster's_Keep,:Battle_of_the_Fist_of_the_First_Men
2	1	0	0	culture of Jeor Mormont	:Jeor_Mormont	:Northmen
0	1	0	0	religion of Finn Umber	:Finn_Umber	:Old_Gods_of_the_Forest
0	1	0	0	whose sibling is Finn Umber	:Finn_Umber	:Morgana_Umber,:Kear_Umber,:Brandon_Umber,:Emilia_Umber
1	1	0	0	episode where Finn Umber was mentioned in	:Finn_Umber	:A_Golden_Crown
2	1	0	0	father of Finn Umber	:Finn_Umber	:Gareth_Umber
0	1	0	0	mentioned is episode Mother's Mercy	:Mother's_Mercy	:Robert_Baratheon
0	1	0	0	Mother's Mercy is the last of	:Mother's_Mercy	:Stannis_Baratheon,:Myrcella_Baratheon,:Myranda,:Meryn_Trant,:Baratheon_General,:Ghita
1	1	0	0	who died in episode Mother's Mercy	:Mother's_Mercy	:Jon_Snow,:Stannis_Baratheon,:Myrcella_Baratheon,:Myranda,:Meryn_Trant,:Simpson,:Baratheon_General,:Gordy
2	1	0	0	appeared in Mother's Mercy	:Mother's_Mercy	:Simpson,:Gordy
0	1	0	0	allegiance of Gelmarr	:Gelmarr	:House_Greyjoy
0	1	0	0	Gelmarr appeared in	:Gelmarr	:Valar_Morghulis
1	1	0	0	the season that Gelmarr appeared in	:Gelmarr	:Season_2
2	1	0	0	culture of Gelmarr	:Gelmarr	:Ironborn
0	1	0	0	what caused death of Luwin	:Luwin	:Dagmer,:Osha
0	1	0	0	title of Luwin	:Luwin	:Maesters
1	1	0	0	allegiance of Luwin	:Luwin	:Winterfell,:Maesters
2	1	0	0	the season that Luwin appeared in	:Luwin	:Season_1,:Season_2
1	1	0	0	a War	:Type:War	:War_of_the_Five_Kings,:Liberation_of_Slaver's_Bay,:Robert's_Rebellion,:Conflict_Beyond_the_Wall,:War_of_Conquest,:Dance_of_the_Dragons,:Greyjoy_Rebellion,:Andal_Invasion,:Forrester-Whitehill_conflict,:War_of_the_Ninepenny_Kings,:Century_of_Blood,:Unification_of_the_North,:Blackfyre_Rebellion,:Faith_Militant_uprising,:Nymeria's_War,:Conquest_of_Dorne,:First_Dornish_War,:The_Long_Night,:Vulture_Hunt,:Ghiscari_Wars,:Fall_of_the_Night's_King,:Rhoynish_Wars,:Defiance_of_Duskendale,:Thousand_Years_War,:Reyne_Rebellion
0	1	0	0	whose predecessor is Joffrey I Baratheon	:Joffrey_Baratheon	:Tommen_Baratheon
0	1	0	0	episode where Joffrey I Baratheon died	:Joffrey_Baratheon	:The_Lion_and_the_Rose
1	1	0	0	location of Joffrey Baratheon	:Joffrey_Baratheon	:King's_Landing
2	1	0	0	preceded Joffrey I Baratheon	:Joffrey_Baratheon	:Robert_Baratheon
0	1	0	0	whose last was The Lion and the Rose	:The_Lion_and_the_Rose	:Joffrey_Baratheon
0	1	0	0	mentioned is episode The Lion and the Rose	:The_Lion_and_the_Rose	:Baelor_Targaryen,:Daeron_I_Targaryen,:Doran_Martell,:Selwyn_Tarth
1	1	0	0	first episode is The Lion and the Rose	:The_Lion_and_the_Rose	:Mace_Tyrell,:Walda_Bolton,:Night_King,:Bastard's_girls
2	1	0	0	appeared in The Lion and the Rose	:The_Lion_and_the_Rose	:Axell_Florent,:Tansy
0	1	0	0	father of Craster's wife	:Craster's_wife_3_(Oathkeeper)	:Craster
0	1	0	0	whose child is Craster's wife	:Craster's_wife_3_(Oathkeeper)	:Craster
1	1	0	0	Craster's wife 3 appeared in	:Craster's_wife_3_(Oathkeeper)	:Oathkeeper
2	1	0	0	family of Craster's wife	:Craster's_wife_3_(Oathkeeper)	:Craster
0	1	0	0	what was preceded by The Broken Man	:The_Broken_Man	:No_One
0	1	0	0	what followed The Broken Man	:The_Broken_Man	:No_One
1	1	0	0	first episode is The Broken Man	:The_Broken_Man	:Robett_Glover,:Lyanna_Mormont,:Lem,:Gatins,:Morgan
2	1	0	0	mentioned is episode The Broken Man	:The_Broken_Man	:Maege_Mormont,:Night_King,:Talisa_Stark,:Galbart_Glover,:Erena_Glover,:Gawen_Glover,:Sybelle_Glover
0	1	0	0	where Sack of Astapor happened	:Sack_of_Astapor	:Bay_of_Dragons,:Astapor
0	1	0	0	what first side of Sack of Astapor is	:Sack_of_Astapor	:House_Targaryen
1	1	0	0	whose first side is Sack of Astapor	:Sack_of_Astapor	:Liberation_of_Slaver's_Bay
2	1	0	0	side one commander of Sack of Astapor	:Sack_of_Astapor	:Daenerys_Targaryen,:Barristan_Selmy,:Jorah_Mormont
0	1	0	0	culture of Tyrek Tallhart	:Tyrek_Tallhart	:Northmen
0	1	0	0	child of Tyrek Tallhart	:Tyrek_Tallhart	:Hollys_Umber
1	1	0	0	episode where Tyrek Tallhart was mentioned in	:Tyrek_Tallhart	:A_Golden_Crown
2	1	0	0	whose father is Tyrek Tallhart	:Tyrek_Tallhart	:Hollys_Umber
0	1	0	0	appeared in Winter Is Coming	:Winter_Is_Coming	:Jon_Arryn,:Waymar_Royce,:Will,:Gared,:White_Walker_(Winter_is_Coming)
0	1	0	0	first episode is Winter Is Coming	:Winter_Is_Coming	:Robert_Baratheon,:Daenerys_Targaryen,:Eddard_Stark,:Jon_Snow,:Tyrion_Lannister,:Joffrey_Baratheon,:Robb_Stark,:Cersei_Lannister,:Jaime_Lannister,:Tommen_Baratheon,:Arya_Stark,:Sansa_Stark,:Bran_Stark,:Sandbox/Jon_Snow_(Updated),:Theon_Greyjoy,:Drogo,:Catelyn_Stark,:Rickon_Stark,:Jorah_Mormont,:Viserys_Targaryen,:Myrcella_Baratheon,:Sandor_Clegane,:Summer,:Ghost,:Benjen_Stark,:Hodor,:Shaggydog,:Grey_Wind,:Rodrik_Cassel,:Lady,:Nymeria_(direwolf),:Preston_Greenfield,:Luwin,:Ros,:Jory_Cassel,:Qotho,:Mago,:Mordane,:Illyrio_Mopatis,:Haggo,:Ian_Whyte,:Jacks,:Cohollo,:Mikken
1	1	0	0	mentioned is episode Winter Is Coming	:Winter_Is_Coming	:Aerys_II_Targaryen,:Rhaegar_Targaryen,:Viserys_I_Targaryen
2	1	0	0	who died in episode Winter Is Coming	:Winter_Is_Coming	:Jon_Arryn,:Waymar_Royce,:Will,:Gared
0	1	0	0	whose religion is Ghiscari religion	:Ghiscari_religion	:Meereen,:Bay_of_Dragons,:Astapor,:Hizdahr_zo_Loraq,:Yunkai,:Razdal_mo_Eraz,:Dezhor_zo_Raza,:Goatherd_(The_Children)
0	1	0	0	allegiance of Waldron Frey	:Waldron_Frey	:House_Frey
0	1	0	0	whose child is Waldron Frey	:Waldron_Frey	:Walder_Frey,:Kitty_Frey
1	1	0	0	whose sibling is Waldron Frey	:Waldron_Frey	:Roslin_Tully,:Lothar_Frey,:Walder_Rivers,:Shirei_Frey,:Walda_Frey_(The_Rains_of_Castamere),:Stevron_Frey,:Derwa_Frey,:Waldra_Frey,:Olyvar_Frey,:Ryger_Rivers,:Arwaya_Frey
2	1	0	0	episode where Waldron Frey was mentioned in	:Waldron_Frey	:Baelor
0	1	0	0	episode "Jaqen H'ghar" first appeared in	:Jaqen_H'ghar	:Fire_and_Blood
0	1	0	0	last of "Jaqen H'ghar"	:Jaqen_H'ghar	:No_One
1	1	0	0	where "Jaqen H'ghar" is	:Jaqen_H'ghar	:Braavos
2	1	0	0	died from "Jaqen H'ghar"	:Jaqen_H'ghar	:Amory_Lorch,:Despondent_man,:The_Tickler
0	1	0	0	a massacre	:Type:Massacre	:Destruction_of_the_Great_Sept_of_Baelor,:Red_Wedding,:Massacre_in_the_Red_Keep,:Assassination_at_Winterfell,:Assassination_of_Renly_I,:Massacre_of_the_Khalar_vezhven,:Riot_of_King's_Landing,:Purple_Wedding,:Sack_of_Winterfell,:Assassinations_at_the_Twins,:Mutiny_at_Castle_Black,:Massacre_in_King's_Landing,:Assassination_at_the_Red_Keep,:Assassination_of_Balon_Greyjoy
0	1	0	0	title of Steffon Baratheon	:Steffon_Baratheon	:Lord_of_Storm's_End,:Lord_Paramount_of_the_Stormlands
0	1	0	0	whose predecessor is Steffon Baratheon	:Steffon_Baratheon	:Robert_Baratheon
1	1	0	0	the season that Steffon Baratheon appeared in	:Steffon_Baratheon	:Season_1,:Season_5
2	1	0	0	place of Steffon Baratheon	:Steffon_Baratheon	:Storm's_End
0	1	0	0	whose child is Rhaegel Targaryen	:Rhaegel_Targaryen	:Daeron_II_Targaryen,:Myriah_Martell
0	1	0	0	where Rhaegel Targaryen is	:Rhaegel_Targaryen	:King's_Landing,:Red_Keep
1	1	0	0	the season that Rhaegel Targaryen appeared in	:Rhaegel_Targaryen	:Season_1
2	1	0	0	father of Rhaegel Targaryen	:Rhaegel_Targaryen	:Daeron_II_Targaryen
0	1	0	0	are of Dornishmen culture	:Dornishmen	:Oberyn_Martell,:Dorne,:Elia_Martell,:Tyene_Sand,:Nymeria_Sand,:Ellaria_Sand,:Obara_Sand,:Myriah_Martell,:Obella_Sand,:Loreza_Sand,:Dorea_Sand,:Elia_Sand,:Sarella_Sand,:Doran_Martell,:Arthur_Dayne,:Trystane_Martell,:Principality_of_Dorne,:Dyanna_Dayne,:Dayne_(son_of_Davos),:Martell_(daughter_of_Mors),:Lewyn_Martell,:Davos_Dayne,:Caleotte,:Mors_Martell,:Maron_Martell,:Aron_Santagar,:Lead_Dornish_guard,:Beric_Dayne,:Daemon_Sand,:Vorian_Dayne
0	1	0	0	what Dornishmen is the side two commander of	:Dornishmen	:Nymeria's_War
1	1	0	0	Dornishmen live in	:Dornishmen	:Dorne,:Principality_of_Dorne
2	1	0	0	died from Dornishmen	:Dornishmen	:Rhaenys_Targaryen_(sister_of_Aegon_I)
0	1	0	0	whose family is Freya Frey	:Freya_Frey	:Merry_Frey
0	1	0	0	allegiance of Freya Frey	:Freya_Frey	:House_Frey
1	1	0	0	location of Freya Frey	:Freya_Frey	:The_Twins
2	1	0	0	family of Freya Frey	:Freya_Frey	:Walder_Frey,:Roslin_Tully,:Shirei_Frey,:Walda_Frey_(The_Rains_of_Castamere),:Derwa_Frey,:Waldra_Frey
0	1	0	0	whose child is Gared's sister	:Gared's_sister	:Gared's_father
0	1	0	0	what Gared's sister is the side one participant of	:Gared's_sister	:Skirmish_at_the_Tuttle_Farm
1	1	0	0	last of Gared's sister	:Gared's_sister	:Iron_From_Ice
2	1	0	0	culture of Gared's sister	:Gared's_sister	:Northmen
0	1	0	0	allegiance of Dothraki crone	:Dothraki_crone	:Dothraki
0	1	0	0	place of Dothraki crone	:Dothraki_crone	:Dothraki_Sea
1	1	0	0	religion of Dothraki crone	:Dothraki_crone	:Great_Stallion
2	1	0	0	the season that Dothraki crone appeared in	:Dothraki_crone	:Season_1
0	1	0	0	Fall of Moat Cailin is a battle of	:Fall_of_Moat_Cailin	:War_of_the_Five_Kings
0	1	0	0	first side force of Fall of Moat Cailin	:Fall_of_Moat_Cailin	:Adrack_Humble
1	1	0	0	what is before Fall of Moat Cailin	:Fall_of_Moat_Cailin	:Assassination_of_Renly_I
2	1	0	0	where Fall of Moat Cailin happened	:Fall_of_Moat_Cailin	:the_North,:Moat_Cailin
0	1	0	0	founded by Artys Arryn	:Artys_Arryn	:The_Vale_of_Arryn,:Kingdom_of_the_Mountain_and_the_Vale
0	1	0	0	what Artys Arryn is the side two commander of	:Artys_Arryn	:Andal_Invasion
1	1	0	0	allegiance of Artys Arryn	:Artys_Arryn	:House_Arryn
2	1	0	0	what Artys Arryn is the side one commander of	:Artys_Arryn	:Battle_of_the_Seven_Stars
0	1	0	0	location of Deepwood Motte	:Deepwood_Motte	:Westeros,:The_North
0	1	0	0	took place in Deepwood Motte	:Deepwood_Motte	:Second_Battle_of_Deepwood_Motte,:First_Battle_of_Deepwood_Motte
1	1	0	0	religion of Deepwood Motte	:Deepwood_Motte	:Old_Gods_of_the_Forest,:Drowned_God
2	1	0	0	Deepwood Motte is a castle in	:Deepwood_Motte	:The_North,:Kingdom_of_the_North
0	1	0	0	what was ruled by House Tully	:House_Tully	:The_Riverlands,:Riverrun,:Lord_of_Riverrun
0	1	0	0	those allied with House Tully	:House_Tully	:Walder_Frey,:Roslin_Tully,:Catelyn_Stark,:Edmure_Tully,:Lysa_Arryn,:Hoster_Tully,:Brynden_Tully,:Minisa_Tully,:Edmyn_Tully,:Tully_(son_of_Edmure),:Jason_Mallister,:Jaremy_Mallister,:Shella_Whent,:Jonos_Bracken
1	1	0	0	whose first side is House Tully	:House_Tully	:Robert's_Rebellion,:War_of_Conquest,:Red_Wedding,:Dance_of_the_Dragons,:Battle_of_the_Trident,:Greyjoy_Rebellion,:Second_Siege_of_Riverrun,:Battle_of_the_Bells,:War_of_the_Ninepenny_Kings,:Burning_of_Harrenhal,:Battle_of_Stone_Mill,:Capture_of_Riverrun
2	1	0	0	whose second side is House Tully	:House_Tully	:War_of_the_Five_Kings,:Siege_of_Riverrun,:Battle_of_the_Golden_Tooth
0	1	0	0	Tansy appeared in	:Tansy	:The_Lion_and_the_Rose
0	1	0	0	allegiance of Tansy	:Tansy	:House_Bolton
1	1	0	0	what caused death of Tansy	:Tansy	:Ramsay_Bolton,:Bastard's_girls
2	1	0	0	whom Tansy is a lover of	:Tansy	:Ramsay_Bolton
0	1	0	0	whose child is Yara Greyjoy	:Yara_Greyjoy	:Balon_Greyjoy,:Alannys_Greyjoy
0	1	0	0	whose family is Yara Greyjoy	:Yara_Greyjoy	:Vickon_Greyjoy
1	1	0	0	allegiance of Yara Greyjoy	:Yara_Greyjoy	:House_Targaryen,:House_Greyjoy
2	1	0	0	episode Yara Greyjoy first appeared in	:Yara_Greyjoy	:The_Night_Lands
0	1	0	0	what first side of First Trial by Combat of Tyrion Lannister is	:First_Trial_by_Combat_of_Tyrion_Lannister	:House_Stark,:House_Arryn
0	1	0	0	second side leader of First Trial by Combat of Tyrion Lannister	:First_Trial_by_Combat_of_Tyrion_Lannister	:Tyrion_Lannister
1	1	0	0	what second side of First Trial by Combat of Tyrion Lannister is	:First_Trial_by_Combat_of_Tyrion_Lannister	:House_Lannister
2	1	0	0	led first side of First Trial by Combat of Tyrion Lannister	:First_Trial_by_Combat_of_Tyrion_Lannister	:Catelyn_Stark,:Lysa_Arryn,:Robin_Arryn
0	1	0	0	the season that Podrick Payne appeared in	:Podrick_Payne	:Season_6,:Season_3,:Season_4,:Season_2,:Season_5,:Season_7
0	1	0	0	family of Podrick Payne	:Podrick_Payne	:Ilyn_Payne
1	1	0	0	whose family is Podrick Payne	:Podrick_Payne	:Ilyn_Payne
2	1	0	0	died from Podrick Payne	:Podrick_Payne	:Mandon_Moore
0	1	0	0	what second side of Battle at the Cave of the Three-eyed Raven is	:Battle_at_the_Cave_of_the_Three-eyed_Raven	:White_Walkers
0	1	0	0	what is before Battle at the Cave of the Three-eyed Raven	:Battle_at_the_Cave_of_the_Three-eyed_Raven	:Mutiny_at_Castle_Black
1	1	0	0	first side force of Battle at the Cave of the Three-eyed Raven	:Battle_at_the_Cave_of_the_Three-eyed_Raven	:Bran_Stark,:Summer,:Benjen_Stark,:Hodor,:Leaf,:Meera_Reed,:Children_of_the_Forest
2	1	0	0	second side force of Battle at the Cave of the Three-eyed Raven	:Battle_at_the_Cave_of_the_Three-eyed_Raven	:Wights
0	1	0	0	episode where Karsi died	:Karsi	:Hardhome_(episode)
0	1	0	0	what Karsi is the side one commander of	:Karsi	:Conflict_Beyond_the_Wall,:Massacre_at_Hardhome
1	1	0	0	the season that Karsi appeared in	:Karsi	:Season_5
2	1	0	0	allegiance of Karsi	:Karsi	:Free_Folk,:White_Walkers,:Mance_Rayder
0	1	0	0	last of Shireen Baratheon	:Shireen_Baratheon	:The_Dance_of_Dragons
0	1	0	0	mother of Shireen Baratheon	:Shireen_Baratheon	:Selyse_Baratheon
1	1	0	0	allegiance of Shireen Baratheon	:Shireen_Baratheon	:House_Baratheon_of_Dragonstone
2	1	0	0	location of Shireen Baratheon	:Shireen_Baratheon	:Dragonstone_(castle)
0	1	0	0	culture of Dyanna Dayne	:Dyanna_Dayne	:Dornishmen
0	1	0	0	allegiance of Dyanna Dayne	:Dyanna_Dayne	:House_Targaryen,:House_Dayne
1	1	0	0	married to Dyanna Dayne	:Dyanna_Dayne	:Maekar_Targaryen
2	1	0	0	child of Dyanna Dayne	:Dyanna_Dayne	:Aegon_V_Targaryen,:Aemon,:Aerion_Targaryen
0	1	0	0	Siege of Old Wyk is a battle of	:Siege_of_Old_Wyk	:Greyjoy_Rebellion
0	1	0	0	what first side of Siege of Old Wyk is	:Siege_of_Old_Wyk	:House_Greyjoy
1	1	0	0	what was concurrent with Siege of Old Wyk	:Siege_of_Old_Wyk	:Siege_of_Great_Wyk
2	1	0	0	what a conflict of Siege of Old Wyk is	:Siege_of_Old_Wyk	:Greyjoy_Rebellion
0	1	0	0	side one commander of Capture of Riverrun	:Capture_of_Riverrun	:Knighthood,:Brynden_Tully
0	1	0	0	what is before Capture of Riverrun	:Capture_of_Riverrun	:Assassination_of_Balon_Greyjoy
1	1	0	0	what followed Capture of Riverrun	:Capture_of_Riverrun	:Standoff_at_the_Great_Sept_of_Baelor
2	1	0	0	commanded second side in Capture of Riverrun	:Capture_of_Riverrun	:Lothar_Frey,:Walder_Rivers
0	1	0	0	religion of Ormund Baratheon	:Ormund_Baratheon	:Faith_of_the_Seven
0	1	0	0	where Ormund Baratheon is	:Ormund_Baratheon	:Storm's_End
1	1	0	0	culture of Ormund Baratheon	:Ormund_Baratheon	:Andals
2	1	0	0	child of Ormund Baratheon	:Ormund_Baratheon	:Steffon_Baratheon
0	1	0	0	episode Drennan first appeared in	:Drennan	:The_Old_Gods_and_the_New
0	1	0	0	the season that Drennan appeared in	:Drennan	:Season_2
1	1	0	0	religion of Drennan	:Drennan	:Drowned_God
2	1	0	0	culture of Drennan	:Drennan	:Ironborn
0	1	0	0	side one participant of Assassinations at the Twins	:Assassinations_at_the_Twins	:Lothar_Frey,:Walder_Rivers
0	1	0	0	what preceded Assassinations at the Twins	:Assassinations_at_the_Twins	:Destruction_of_the_Great_Sept_of_Baelor,:Duel_in_Braavos
1	1	0	0	where Assassinations at the Twins took place	:Assassinations_at_the_Twins	:The_Twins,:the_Riverlands
2	1	0	0	what second side of Assassinations at the Twins is	:Assassinations_at_the_Twins	:Arya_Stark
0	1	0	0	the season that Gareth Umber appeared in	:Gareth_Umber	:Season_1
0	1	0	0	father of Gareth Umber	:Gareth_Umber	:Hothor_Umber
1	1	0	0	sibling of Gareth Umber	:Gareth_Umber	:Regan_Karstark,:Joseth_Umber,:Mycah_Umber,:Corin_Umber,:Lucan_Umber,:Harkon_Umber
2	1	0	0	mother of Gareth Umber	:Gareth_Umber	:Amarylis_Umber
0	1	0	0	Astapor is city of	:Astapor	:Bay_of_Dragons
0	1	0	0	who rules Astapor	:Astapor	:Cleon
1	1	0	0	is in Astapor	:Astapor	:Yezzan_zo_Qaggaz,:Greizhen_mo_Ullhor,:Kraznys_mo_Nakloz,:Cleon,:Unsullied_1_(Valar_Dohaeris)
2	1	0	0	religion of Astapor	:Astapor	:Ghiscari_religion
0	1	0	0	death episode of Lady	:Lady	:The_Kingsroad
0	1	0	0	first episode of Lady	:Lady	:Winter_Is_Coming
1	1	0	0	family of Lady	:Lady	:Summer,:Ghost,:Shaggydog,:Grey_Wind,:Nymeria_(direwolf)
2	1	0	0	the season that Lady appeared in	:Lady	:Season_1
0	1	0	0	father of Laurence Karstark	:Laurence_Karstark	:Commard_Karstark
0	1	0	0	culture of Laurence Karstark	:Laurence_Karstark	:Northmen
1	1	0	0	the season that Laurence Karstark appeared in	:Laurence_Karstark	:Season_1
2	1	0	0	whose family is Laurence Karstark	:Laurence_Karstark	:Beric_Karstark,:Mara_Karstark
0	1	0	0	the season that Baratheon officer appeared in	:Baratheon_officer	:Season_2
0	1	0	0	what Baratheon officer is the side two commander of	:Baratheon_officer	:Battle_of_the_Blackwater
1	1	0	0	Baratheon officer appeared in	:Baratheon_officer	:Blackwater
2	1	0	0	what caused death of Baratheon officer	:Baratheon_officer	:Tyrion_Lannister,:Battle_of_the_Blackwater
0	1	0	0	whose first side is Yunkai	:Yunkai	:Siege_of_Astapor
0	1	0	0	whose second side is Yunkai	:Yunkai	:Liberation_of_Slaver's_Bay,:Second_Siege_of_Meereen,:Battle_of_Yunkai
1	1	0	0	religion of Yunkai	:Yunkai	:Ghiscari_religion
2	1	0	0	located in Yunkai	:Yunkai	:Battle_of_Yunkai
0	1	0	0	the season that Bastard's girls appeared in	:Bastard's_girls	:Season_6,:Season_4,:Season_5
0	1	0	0	killed by Bastard's girls	:Bastard's_girls	:Ramsay_Bolton,:Walda_Bolton,:Bolton_(son_of_Roose),:Tansy
1	1	0	0	episode Bastard's girls first appeared in	:Bastard's_girls	:The_Lion_and_the_Rose
2	1	0	0	allegiance of Bastard's girls	:Bastard's_girls	:House_Stark,:Ramsay_Bolton
0	1	0	0	the season that Doran Martell appeared in	:Doran_Martell	:Season_6,:Season_5
0	1	0	0	whose first side leader is Doran Martell	:Doran_Martell	:Coup_in_Dorne
1	1	0	0	whose father is Doran Martell	:Doran_Martell	:Trystane_Martell
2	1	0	0	last of Doran Martell	:Doran_Martell	:The_Red_Woman
0	1	0	0	died from Harys	:Harys	:Rodrik_Forrester,:Asher_Forrester,:Elissa_Forrester,:The_Beast,:Bowen_(Squire),:Erik
0	1	0	0	first episode of Harys	:Harys	:The_Sword_in_the_Darkness
1	1	0	0	what Harys is the side two commander of	:Harys	:Battle_of_Ironrath,:Forrester-Whitehill_conflict,:Ambush_at_the_Harbor
2	1	0	0	whose second side casualty is Harys	:Harys	:Battle_of_Ironrath
0	1	0	0	succeeded by Harald Karstark	:Harald_Karstark	:Rickard_Karstark
0	1	0	0	preceded Harald Karstark	:Harald_Karstark	:Rickard_Karstark
1	1	0	0	what Harald Karstark is the side two participant of	:Harald_Karstark	:Assassination_at_Winterfell
2	1	0	0	what Harald Karstark is the side two commander of	:Harald_Karstark	:Battle_of_the_Bastards
0	1	0	0	sibling of Brynden Rivers	:Brynden_Rivers	:Daeron_II_Targaryen,:Daemon_I_Blackfyre,:Daenerys_Targaryen_(daughter_of_Aegon_IV),:Aegor_Rivers,:Shiera_Seastar
0	1	0	0	culture of Brynden Rivers	:Brynden_Rivers	:Valyrians
1	1	0	0	whose child is Brynden Rivers	:Brynden_Rivers	:Aegon_IV_Targaryen
2	1	0	0	what Brynden Rivers is the side two commander of	:Brynden_Rivers	:Blackfyre_Rebellion
0	1	0	0	what a conflict of Massacre in King's Landing is	:Massacre_in_King's_Landing	:War_of_the_Five_Kings
0	1	0	0	place of Massacre in King's Landing	:Massacre_in_King's_Landing	:King's_Landing
1	1	0	0	side one participant of Massacre in King's Landing	:Massacre_in_King's_Landing	:Janos_Slynt,:City_Watch
2	1	0	0	what first side of Massacre in King's Landing is	:Massacre_in_King's_Landing	:House_Baratheon_of_King's_Landing,:City_Watch
0	1	0	0	where Argalia Baratheon is	:Argalia_Baratheon	:Storm's_End
0	1	0	0	whose child is Argalia Baratheon	:Argalia_Baratheon	:Argilac_Durrandon
1	1	0	0	family of Argalia Baratheon	:Argalia_Baratheon	:Mychal_Baratheon
2	1	0	0	the season that Argalia Baratheon appeared in	:Argalia_Baratheon	:Season_1
0	1	0	0	first episode of Sandor Clegane	:Sandor_Clegane	:Winter_Is_Coming
0	1	0	0	culture of Sandor Clegane	:Sandor_Clegane	:Andals
1	1	0	0	sibling of Sandor Clegane	:Sandor_Clegane	:Gregor_Clegane
2	1	0	0	killed by Sandor Clegane	:Sandor_Clegane	:Lem,:Biter,:Mycah,:Gatins,:Morgan
0	1	0	0	whose mother is Hollys Umber	:Hollys_Umber	:Morgana_Umber,:Finn_Umber,:Kear_Umber,:Brandon_Umber,:Emilia_Umber
0	1	0	0	child of Hollys Umber	:Hollys_Umber	:Morgana_Umber,:Finn_Umber,:Kear_Umber,:Brandon_Umber,:Emilia_Umber
1	1	0	0	father of Hollys Umber	:Hollys_Umber	:Tyrek_Tallhart
2	1	0	0	allegiance of Hollys Umber	:Hollys_Umber	:House_Umber
0	1	0	0	first episode of Daario Naharis	:Daario_Naharis	:Second_Sons_(episode)
0	1	0	0	the season that Daario Naharis appeared in	:Daario_Naharis	:Season_6,:Season_3,:Season_4,:Season_5
1	1	0	0	last of Daario Naharis	:Daario_Naharis	:The_Winds_of_Winter
2	1	0	0	culture of Daario Naharis	:Daario_Naharis	:Tyrosh
2	1	0	0	whose title is Lord Commander of the Kingsguard	:Lord_Commander_of_the_Kingsguard	:Jaime_Lannister,:Loras_Tyrell,:Barristan_Selmy,:Gerold_Hightower,:Aemon_Targaryen_(Dragonknight),:Criston_Cole,:Duncan_the_Tall
2	1	0	0	what Lord Commander of the Kingsguard is the side one commander of	:Lord_Commander_of_the_Kingsguard	:Butcher's_Ball
0	1	0	0	what Lord Commander of the Kingsguard is the side two commander of	:Lord_Commander_of_the_Kingsguard	:Dance_of_the_Dragons,:Showdown_at_the_Tower_of_Joy
0	1	0	0	what Lordship is the side two commander of	:Lordship	:War_of_the_Five_Kings
2	1	0	0	what Lordship is the side one commander of	:Lordship	:War_of_the_Five_Kings,:Second_Siege_of_Meereen
0	1	0	0	located in Tarth	:Tarth	:Endrew_Tarth
